{
  "schema_version": "1.0.0",
  "id": "kou-012",
  "title": "講とOSSは似ている？ みんなの知恵を、みんなの力に",
  "duration_seconds": 90,
  "read_aloud": "昔の日本にあった「講」。\n\nそして、インターネット時代の「OSS」。\n\nOSSとは、オープンソースソフトウェアのことです。\n\nソフトウェアの設計やソースコードを公開し、ライセンスの条件に従って、誰もが利用したり、改良したり、再配布したりできる仕組みです。\n\n一見、山に登る講と、コンピューターのソフトウェアは関係なさそうです。\n\nでも、共通点があります。\n\nそれは、ひとりで全部をつくるのではなく、みんなの知恵や労力を持ち寄ること。\n\nある人がつくった道具を、別の人が使う。\n\n使って気づいた問題を、誰かが直す。\n\nその改良を、また別の誰かが活用する。\n\nひとりの仕事が、次の人の出発点になるのです。\n\nOSSの世界では、コードを書く人だけが貢献者ではありません。\n\n不具合を報告する人。説明書を書く人。翻訳する人。初めて使う人を助ける人。\n\nさまざまな関わり方があります。\n\nただし、公開すれば自動的にうまくいくわけではありません。\n\n誰かが保守し、質問に答え、方針を決めなければ、プロジェクトは続きません。\n\n貢献が一部の人に集中したり、感謝も支援も届かなかったりする問題もあります。\n\nだからこそ、技術だけでなく、支え合う仕組みが必要なのです。\n\n講が、人々の願いを仲間の力で支えたように。\n\nOSSは、誰かの知恵を、世界中の人が使える力に変えてきました。\n\nでは、この考え方を、ソフトウェアだけでなく、人の夢にも活かせないでしょうか。\n\nプログラムを一緒につくるように、誰かの夢に知恵を貸す。\n\n小さな手伝いを、次の人へつないでいく。\n\nひとりでは登れない山もある。\n\n誰かの夢を、みんなで育てる「令和の講」へ。\n\nそれが、KOUの挑戦です。",
  "production_notes": {
    "summary": "歴史的な講とOSSを、知恵や労力を持ち寄り、ひとりの成果を次の人の出発点にする仕組みとして比較する。OSSの保守負担や貢献の偏りにも触れ、人の夢への相互支援につなげる。",
    "visuals": [
      "昔の村で人々が集まる風景",
      "ソースコードを共同で改良する画面",
      "不具合報告、翻訳、説明書づくりなど多様な貢献",
      "人々が知恵や技能を持ち寄り、誰かの夢を支える場面"
    ],
    "direction": "講とOSSを同一視せず、共同貢献と知恵の継承という共通点を中心に描く。",
    "ending": "ひとりでは登れない山もある。"
  },
  "tags": [
    "講",
    "OSS",
    "オープンソース",
    "相互扶助",
    "KOU"
  ]
}
