{
  "schema_version": "1.0.0",
  "id": "kou-013",
  "title": "著作権の未来と二次創作——誰かの作品から、みんなの夢が生まれる",
  "duration_seconds": 90,
  "read_aloud": "誰かの作品に感動して、自分でも何かをつくりたくなった。\n\n好きな漫画の続きを想像する。\n憧れの音楽を演奏する。\n物語の登場人物を、自分なりに描いてみる。\n\nそんな創作を、二次創作と呼びます。\n\n文化は、こうした「誰かに影響を受けること」からも育ってきました。\n\nでも、ここには難しい問題があります。\n\n作品をつくった人の権利を、どう守るのか。\n\nそして、その作品に心を動かされた人の、表現したい気持ちをどう支えるのか。\n\n著作権は、創作者の権利を守るための大切な仕組みです。\n\n一方で、二次創作がどこまで許されるかは、作品や利用方法、権利者の方針などによって異なります。\n\n好きだから何をしてもいい、というわけではありません。\n\nだからといって、すべての創作のつながりを、あきらめる必要もないはずです。\n\nたとえば、二次創作を歓迎するルールを公開する。\n\n使ってよい素材や条件を明確にする。\n\n作品を生んだ人にも、受け継いで新しいものをつくる人にも、敬意と利益が届く方法を考える。\n\nOSSが、共有できるコードを次の人の出発点にしたように、創作にも、安心して受け継げる仕組みをつくれないでしょうか。\n\nそして、KOUが応援したいのは、作品だけではありません。\n\n誰かの作品に憧れて、漫画家になりたいと思った人。\n音楽を聴いて、自分も曲をつくりたくなった人。\n誰かの夢を見て、自分の夢に気づいた人。\n\n夢は、ひとりの心から生まれても、誰かとの出会いによって育つことがあります。\n\n誰かの創作が、次の誰かの創作を生む。\n\n誰かの夢が、次の誰かの夢を生む。\n\nその連鎖を、権利を尊重しながら支えることはできないでしょうか。\n\nひとりでは登れない山もある。\n\n誰かの夢を、誰かの夢の出発点にする。\n\nそれも、令和の講「KOU」が考えたい未来です。",
  "production_notes": {
    "summary": "著作権者の権利と二次創作の可能性を両立させ、創作が次の夢につながる仕組みをKOUの思想に結びつける。",
    "visuals": [
      "漫画や音楽などの作品に心を動かされる人",
      "ファンが自分なりの作品をつくる手元",
      "OSSの共有・改良から創作の連鎖へ移るイメージ",
      "人々が互いの夢を応援する場面"
    ],
    "direction": "著作権を否定せず、権利の尊重と創作の連鎖を両立させる視点で語る。",
    "ending": "誰かの夢を、誰かの夢の出発点にする。"
  },
  "tags": [
    "講",
    "KOU",
    "著作権",
    "二次創作",
    "OSS",
    "創作"
  ]
}
