{
  "schema_version": "1.0.0",
  "id": "kou-014",
  "title": "孤独と村社会と疎結合の未来——つながりたい。でも、縛られたくない",
  "duration_seconds": 90,
  "read_aloud": "ひとりは、気楽です。\n\n誰かに気を遣わなくてもいい。\n自分の時間を、自分のために使える。\n\nでも、困ったとき。\n夢を語りたいとき。\n誰かに喜びを分かち合いたいとき。\n\nひとりでは、どうにもならないことがあります。\n\n昔の村には、助け合いの仕組みがありました。\n\n田植えや屋根の修理を手伝う。\n困った家があれば、みんなで支える。\n\n講も、そんな助け合いを支える仕組みのひとつでした。\n\nところが、村には別の顔もありました。\n\n周囲に合わせる圧力。\nよそ者への警戒。\n集団から外れることへの不安。\n\n助け合いと引き換えに、自由を失うこともあったのです。\n\nでは、現代はどうでしょう。\n\nインターネットで、世界中の人とつながれる。\n\nそれなのに、孤独を感じることがある。\n\nつながる手段は増えたのに、安心して頼れる関係をつくるのは、簡単ではありません。\n\n必要なのは、昔の村に戻ることでも、すべてをひとりで抱えることでもないはずです。\n\nそこで考えたいのが、ゆるやかにつながる「疎結合」という考え方です。\n\nいつも一緒にいなくてもいい。\n同じ考え方を持たなくてもいい。\n必要なときに、できる範囲で助け合える。\n\n参加してもいい。\n休んでもいい。\n離れてもいい。\n\nそして、また戻ってきてもいい。\n\n人と人との関係にも、そんな余白をつくれないでしょうか。\n\n誰かの夢を応援するために、人生のすべてを差し出す必要はありません。\n\n一時間だけ知恵を貸す。\n道具をひとつ提供する。\n経験を短い言葉で伝える。\n\n小さな関わりが集まれば、ひとりでは難しかったことが動き始めます。\n\nつながりを強制せず、助け合いの可能性を閉ざさない。\n\n孤独をなくすために、全員を同じ村に住まわせるのではなく、それぞれが自分の場所で暮らしながら、必要なときに出会える仕組みをつくる。\n\nそれが、令和の講「KOU」が目指す未来です。\n\nひとりでは登れない山もある。\n\nでも、全員が同じ山を登る必要もないのです。",
  "production_notes": {
    "summary": "村社会の助け合いと同調圧力の両面を示し、自由を保ちながら必要なときに協力できる疎結合の共同体をKOUの未来として描く。",
    "visuals": [
      "村人が田植えや家の修理を助け合う風景",
      "集団の中で周囲に合わせることを求められる人",
      "別々の場所で暮らす人々がオンラインでつながる様子",
      "知恵や道具を少しずつ持ち寄って誰かの夢を支える場面"
    ],
    "direction": "昔の村を美化も断罪もせず、助け合いと自由の両立を中心に語る。",
    "ending": "でも、全員が同じ山を登る必要もないのです。"
  },
  "tags": [
    "KOU",
    "孤独",
    "村社会",
    "疎結合",
    "相互扶助",
    "夢"
  ]
}
