{
  "schema_version": "1.0.0",
  "id": "kou-011",
  "title": "講とDAOは似ている？ 時代を超える「みんなで決め、みんなで支える」",
  "duration_seconds": 90,
  "read_aloud": "昔の日本にあった「講」。\n\nそして、インターネット時代に生まれた「DAO」。\n\n一見、まったく違うものに見えます。\n\nでも、ひとつの共通点があります。\n\nそれは、ひとりではできないことを、みんなの力で実現しようとすることです。\n\n昔の講では、人々がお金を出し合い、知恵や労力を持ち寄りました。\n\n伊勢参りに行く。富士山に登る。誰かの商売を支える。\n\n個人の願いを、仲間の仕組みに変えていたのです。\n\n一方、DAOは、インターネット上で人々が集まり、共通の目的に向かって活動する仕組みです。\n\nルールを公開したり、スマートコントラクトを使ったり、参加者が意思決定に関わったりするものもあります。\n\n時代も技術も違います。\n\n昔の講が、そのまま現代のDAOだったわけではありません。\n\nそれでも、問いは共通しています。\n\n誰が参加できるのか。\n誰が決めるのか。\n誰が負担し、誰が恩恵を受けるのか。\n\nみんなのための仕組みが、一部の人だけのものになってしまったら、助け合いは続きません。\n\nだから、必要なのは新しい技術だけではないのです。\n\n人が集まり、信頼を育て、誰かの願いを一緒に実現すること。\n\n昔の講から学び、現代の技術を活かして、そんな仕組みをつくれないでしょうか。\n\nひとりでは登れない山もある。\n\n誰かの夢を、本人の努力だけに任せなくてもいい社会へ。\n\nそれが、令和の講「KOU」の目指す未来です。",
  "production_notes": {
    "summary": "歴史的な講と現代のDAOを、共同目的・資源の持ち寄り・意思決定という観点で比較する。両者を同一視せず、参加や権力の偏りにも触れる。",
    "visuals": [
      "昔の村で人々が集まる風景",
      "富士山へ向かう人々",
      "オンラインで知恵や技能を持ち寄る人々",
      "共同で何かをつくる現代のコミュニティ"
    ],
    "direction": "講とDAOを同じものとして描かず、時代を超えて共通する問いを見せる。",
    "ending": "ひとりでは登れない山もある。"
  },
  "tags": [
    "講",
    "DAO",
    "相互扶助",
    "KOU",
    "歴史"
  ]
}
